area,header,class,method,method_line,method_status,matched_capi,triage,priority,residual_kind,signature,generator_action,note
include/gpu,include/gpu/ganesh/GrExternalTextureGenerator.h,GrExternalTexture,getBackendTexture,12,covered,GrExternalTexture_getBackendTexture,real_gap,P3,implementation_done,virtual GrBackendTexture getBackendTexture() = 0;,Phase 28 Ganesh external texture bridge,Implemented concrete C external texture object with owned backend texture copy accessor.
include/gpu,include/gpu/ganesh/GrExternalTextureGenerator.h,GrExternalTexture,dispose,13,covered,GrExternalTexture_dispose,real_gap,P3,implementation_done,virtual void dispose() = 0;,Phase 28 Ganesh external texture bridge,Implemented idempotent dispose callback; delete also disposes once.
include/gpu,include/gpu/ganesh/GrExternalTextureGenerator.h,GrExternalTextureGenerator,GrExternalTextureGenerator,18,covered,GrExternalTextureGenerator_new,real_gap,P3,implementation_done,GrExternalTextureGenerator(const SkImageInfo& info);,Phase 28 Ganesh external texture bridge,Implemented concrete C callback generator constructor.
include/gpu,include/gpu/ganesh/GrExternalTextureGenerator.h,GrExternalTextureGenerator,onGenerateTexture,20,covered,SkImages_DeferredFromTextureGenerator,real_gap,P3,implementation_done,"GrSurfaceProxyView onGenerateTexture(GrRecordingContext*, const SkImageInfo&, skgpu::Mipmapped, GrImageTexGenPolicy) override;",Phase 28 Ganesh external texture bridge,The protected/internal generation path is exposed through the safe higher-level SkImages_DeferredFromTextureGenerator factory.
include/gpu,include/gpu/ganesh/GrExternalTextureGenerator.h,GrExternalTextureGenerator,generateExternalTexture,23,covered,GrExternalTextureGenerator_generateExternalTexture,real_gap,P3,implementation_done,"virtual std::unique_ptr<GrExternalTexture> generateExternalTexture(GrRecordingContext *, skgpu::Mipmapped) = 0;",Phase 28 Ganesh external texture bridge,Implemented C callback bridge returning an owned external texture object consumed by the generator.
